{
  "$schema": "https://json-schema.org/draft/2020-12/schema",
  "$id": "https://puzzleatlas.local/schema/style-pack.schema.json",
  "title": "PuzzleAtlas Style Pack",
  "description": "A standalone, pluggable file that sets the visual and tonal norms for a hunt's player-facing presentation (Preview and, eventually, the Player App). Referenced by a Hunt document as hunt.stylePack. Does not affect the Studio's own editor chrome — only the content players see.",
  "type": "object",
  "required": ["schemaVersion", "id", "name", "typography", "palette"],
  "properties": {
    "schemaVersion": {
      "type": "string",
      "description": "Style-pack schema version, independent of the hunt schema version.",
      "const": "0.1.0"
    },
    "id": {
      "type": "string",
      "description": "Stable unique identifier, kebab-case.",
      "pattern": "^[a-z0-9]+(-[a-z0-9]+)*$"
    },
    "name": {
      "type": "string",
      "description": "Human-readable name shown in the style pack picker."
    },
    "description": {
      "type": "string",
      "description": "One or two sentences describing the intended feel and use case."
    },
    "vibe": {
      "type": "object",
      "description": "Narrative/tone guidance for authors (and future AI-assisted drafting). Informational only — not rendered as CSS.",
      "properties": {
        "tags": {
          "type": "array",
          "items": { "type": "string" },
          "description": "Short descriptive tags, e.g. ['noir', '1940s pressroom', 'urgent']."
        },
        "toneNotes": {
          "type": "string",
          "description": "A sentence or two of writing-voice guidance, e.g. 'Clipped, present-tense, slightly hard-boiled.'"
        }
      }
    },
    "typography": {
      "type": "object",
      "required": ["headingFont", "bodyFont"],
      "properties": {
        "headingFont": {
          "type": "string",
          "description": "CSS font-family value (comma-separated stack) used for titles, node headings, ending names."
        },
        "bodyFont": {
          "type": "string",
          "description": "CSS font-family value used for scene/prompt body text."
        },
        "monoFont": {
          "type": "string",
          "description": "CSS font-family value for codes, answers-in-progress, evidence references. Falls back to bodyFont if omitted."
        },
        "headingTransform": {
          "type": "string",
          "enum": ["none", "uppercase", "capitalize"],
          "default": "none"
        },
        "headingLetterSpacing": {
          "type": "string",
          "description": "CSS letter-spacing value, e.g. '0.04em'.",
          "default": "normal"
        },
        "importUrl": {
          "type": "string",
          "description": "Optional stylesheet URL (e.g. a Google Fonts link) the Studio may inject for live preview while authoring online. Not required for offline play — offline packaging of actual font files is a later, separate media-pipeline concern."
        }
      }
    },
    "palette": {
      "type": "object",
      "required": ["background", "surface", "text", "textDim", "accent"],
      "properties": {
        "background": { "type": "string", "description": "CSS colour. Page/scene background." },
        "surface": { "type": "string", "description": "CSS colour. Cards, panels, buttons." },
        "text": { "type": "string", "description": "CSS colour. Primary text." },
        "textDim": { "type": "string", "description": "CSS colour. Secondary/meta text." },
        "accent": { "type": "string", "description": "CSS colour. Primary interactive/highlight colour." },
        "accent2": { "type": "string", "description": "CSS colour. Secondary highlight, used sparingly." },
        "ok": { "type": "string", "description": "CSS colour. Correct-answer / success feedback." },
        "warn": { "type": "string", "description": "CSS colour. Hints, cautions." },
        "danger": { "type": "string", "description": "CSS colour. Incorrect-answer feedback." },
        "families": {
          "type": "object",
          "description": "Optional accent colours per node family, for any presentation surface that distinguishes them (e.g. open-leads list, evidence casebook).",
          "properties": {
            "narrative": { "type": "string" },
            "puzzle": { "type": "string" },
            "state": { "type": "string" },
            "control": { "type": "string" },
            "support": { "type": "string" }
          }
        }
      }
    },
    "shape": {
      "type": "object",
      "description": "Controls how sharp/soft the player-facing UI feels.",
      "properties": {
        "radius": { "type": "string", "description": "CSS border-radius value, e.g. '2px' or '14px'.", "default": "8px" },
        "borderWidth": { "type": "string", "default": "1px" },
        "borderStyle": { "type": "string", "enum": ["none", "solid", "dashed", "double"], "default": "solid" }
      }
    },
    "imagery": {
      "type": "object",
      "description": "Default treatment applied to any image content within a node once media support exists. Forward-looking — not yet consumed by Phase 1 text-only nodes.",
      "properties": {
        "treatment": {
          "type": "string",
          "enum": ["none", "grayscale", "sepia", "duotone", "high-contrast"],
          "default": "none"
        },
        "filterCss": {
          "type": "string",
          "description": "Explicit CSS filter() value implementing the treatment, e.g. 'grayscale(1) sepia(0.3) contrast(1.1)'."
        }
      }
    },
    "motion": {
      "type": "object",
      "properties": {
        "pace": { "type": "string", "enum": ["none", "subtle", "standard", "dramatic"], "default": "subtle" },
        "reducedMotionSafe": { "type": "boolean", "default": true }
      }
    }
  }
}
