{
  "schemaVersion": "0.1.0",
  "id": "bright-academic",
  "name": "Bright Academic",
  "description": "A light, clean museum-exhibit look. Confident sans headlines, generous whitespace feel, restrained ink-blue accent. Suits armchair hunts and evidence-driven deduction.",
  "vibe": {
    "tags": ["museum exhibit", "archival", "daylight", "precise", "calm confidence"],
    "toneNotes": "Measured, curatorial voice. Present facts plainly and let the deduction be the drama, not the prose."
  },
  "typography": {
    "headingFont": "'Source Serif Pro', Georgia, serif",
    "bodyFont": "'Inter', -apple-system, BlinkMacSystemFont, 'Segoe UI', sans-serif",
    "monoFont": "'IBM Plex Mono', 'Courier New', monospace",
    "headingTransform": "none",
    "headingLetterSpacing": "normal",
    "importUrl": "https://fonts.googleapis.com/css2?family=Source+Serif+Pro:wght@600;700&family=Inter:wght@400;600&display=swap"
  },
  "palette": {
    "background": "#f6f3ec",
    "surface": "#ffffff",
    "text": "#211f1b",
    "textDim": "#6b675c",
    "accent": "#1f4e79",
    "accent2": "#a8763e",
    "ok": "#2f7d4f",
    "warn": "#b8823a",
    "danger": "#b3352c",
    "families": {
      "narrative": "#1f4e79",
      "puzzle": "#a8763e",
      "state": "#2f7d4f",
      "control": "#6a3fa0",
      "support": "#2b7f8c"
    }
  },
  "shape": {
    "radius": "6px",
    "borderWidth": "1px",
    "borderStyle": "solid"
  },
  "imagery": {
    "treatment": "none",
    "filterCss": ""
  },
  "motion": {
    "pace": "subtle",
    "reducedMotionSafe": true
  }
}
