{
  "schemaVersion": "0.1.0",
  "id": "neon-arcade",
  "name": "Neon Arcade",
  "description": "High-contrast, playful, celebratory. Rounded shapes, punchy magenta/cyan accents. Suits party hunts and short social experiences.",
  "vibe": {
    "tags": ["party", "neon", "playful", "high-energy", "celebratory"],
    "toneNotes": "Upbeat, second-person, a little cheeky. Short exclamatory beats for correct answers; encouraging, not mocking, for wrong ones."
  },
  "typography": {
    "headingFont": "'Poppins', 'Segoe UI', sans-serif",
    "bodyFont": "'Poppins', 'Segoe UI', sans-serif",
    "monoFont": "'Space Mono', 'Courier New', monospace",
    "headingTransform": "uppercase",
    "headingLetterSpacing": "0.02em",
    "importUrl": "https://fonts.googleapis.com/css2?family=Poppins:wght@500;700&family=Space+Mono&display=swap"
  },
  "palette": {
    "background": "#1a1030",
    "surface": "#26183f",
    "text": "#f5f0ff",
    "textDim": "#b8a8d8",
    "accent": "#ff3fa4",
    "accent2": "#35e0e0",
    "ok": "#4be07f",
    "warn": "#ffcf4d",
    "danger": "#ff5c5c",
    "families": {
      "narrative": "#35e0e0",
      "puzzle": "#ff3fa4",
      "state": "#4be07f",
      "control": "#ffcf4d",
      "support": "#9d7bff"
    }
  },
  "shape": {
    "radius": "16px",
    "borderWidth": "2px",
    "borderStyle": "solid"
  },
  "imagery": {
    "treatment": "high-contrast",
    "filterCss": "saturate(1.4) contrast(1.1)"
  },
  "motion": {
    "pace": "dramatic",
    "reducedMotionSafe": true
  }
}
